{
  "$schema": "./blocks.schema.json",
  "version": 1,
  "sections": [
    "Basic",
    "Lists",
    "Callouts",
    "Layout",
    "Data",
    "Charts and plans",
    "Diagrams",
    "Media",
    "Interactive"
  ],
  "nodes": [
    {
      "name": "doc",
      "doc": "The page body.",
      "impl": "tiptap",
      "content": "block+"
    },
    {
      "name": "paragraph",
      "doc": "A paragraph; its block ID is written `^blk-xxxxxxxx` after the last line.",
      "impl": "tiptap",
      "group": "block",
      "content": "inline*",
      "blockId": true,
      "markdown": "paragraph",
      "slash": [
        {
          "title": "Text",
          "description": "Plain paragraph",
          "keywords": ["paragraph", "p"],
          "section": "Basic",
          "icon": "notes"
        }
      ]
    },
    {
      "name": "heading",
      "doc": "An ATX heading, levels 1 to 6.",
      "impl": "tiptap",
      "group": "block",
      "content": "inline*",
      "defining": true,
      "blockId": true,
      "markdown": "heading",
      "attrs": {
        "level": { "type": "integer", "default": 1, "min": 1, "max": 6 },
        "attributes": { "type": "string", "default": "" }
      },
      "slash": [
        {
          "title": "Heading 1",
          "description": "Large section heading",
          "keywords": ["h1", "title"],
          "section": "Basic",
          "icon": "format_h1",
          "attrs": { "level": 1 }
        },
        {
          "title": "Heading 2",
          "description": "Medium section heading",
          "keywords": ["h2"],
          "section": "Basic",
          "icon": "format_h2",
          "attrs": { "level": 2 }
        },
        {
          "title": "Heading 3",
          "description": "Small section heading",
          "keywords": ["h3"],
          "section": "Basic",
          "icon": "format_h3",
          "attrs": { "level": 3 }
        }
      ]
    },
    {
      "name": "blockquote",
      "doc": "A `>` block quote.",
      "impl": "tiptap",
      "group": "block",
      "content": "block+",
      "defining": true,
      "blockId": true,
      "markdown": "blockquote",
      "slash": [
        {
          "title": "Quote",
          "description": "Quoted text",
          "keywords": ["blockquote", "cite"],
          "section": "Basic",
          "icon": "format_quote"
        }
      ]
    },
    {
      "name": "horizontalRule",
      "doc": "A `---` thematic break.",
      "impl": "tiptap",
      "group": "block",
      "atom": true,
      "markdown": "thematic_break",
      "slash": [
        {
          "title": "Divider",
          "description": "Horizontal line",
          "keywords": ["hr", "rule", "separator"],
          "section": "Basic",
          "icon": "horizontal_rule"
        }
      ]
    },
    {
      "name": "codeBlock",
      "doc": "A fenced code block; the language is the first word of the info string.",
      "impl": "custom",
      "group": "block",
      "content": "text*",
      "marks": "",
      "code": true,
      "defining": true,
      "blockId": true,
      "markdown": "fence:code",
      "attrs": {
        "language": { "type": "string", "default": "" },
        "args": { "type": "string", "default": "" },
        "attributes": { "type": "string", "default": "" }
      },
      "slash": [
        {
          "title": "Code",
          "description": "Code with syntax colours",
          "keywords": ["fence", "snippet", "pre"],
          "section": "Basic",
          "icon": "code"
        }
      ]
    },
    {
      "name": "mathBlock",
      "doc": "Display math between `$$` lines.",
      "impl": "custom",
      "group": "block",
      "content": "text*",
      "marks": "",
      "code": true,
      "defining": true,
      "blockId": true,
      "markdown": "math",
      "slash": [
        {
          "title": "Math",
          "description": "A TeX equation",
          "keywords": ["latex", "tex", "equation", "formula"],
          "section": "Basic",
          "icon": "function"
        }
      ]
    },
    {
      "name": "bulletList",
      "doc": "A `-` bullet list.",
      "impl": "tiptap",
      "group": "block list",
      "content": "(listItem | taskItem)+",
      "markdown": "list:bullet",
      "attrs": {
        "tight": { "type": "boolean", "default": true }
      },
      "slash": [
        {
          "title": "Bulleted list",
          "description": "A simple list",
          "keywords": ["ul", "unordered", "bullets"],
          "section": "Lists",
          "icon": "format_list_bulleted"
        }
      ]
    },
    {
      "name": "orderedList",
      "doc": "A numbered list.",
      "impl": "tiptap",
      "group": "block list",
      "content": "(listItem | taskItem)+",
      "markdown": "list:ordered",
      "attrs": {
        "start": {
          "type": "integer",
          "default": 1,
          "min": 0,
          "max": 999999999
        },
        "tight": { "type": "boolean", "default": true }
      },
      "slash": [
        {
          "title": "Numbered list",
          "description": "A list with numbers",
          "keywords": ["ol", "ordered", "numbers"],
          "section": "Lists",
          "icon": "format_list_numbered"
        }
      ]
    },
    {
      "name": "listItem",
      "doc": "An item of a bullet or numbered list.",
      "impl": "tiptap",
      "content": "paragraph block*",
      "defining": true,
      "markdown": "list_item"
    },
    {
      "name": "taskList",
      "doc": "A `- [ ]` task list; each task is projected into My Work.",
      "impl": "tiptap",
      "group": "block list",
      "content": "taskItem+",
      "markdown": "list:task",
      "attrs": {
        "tight": { "type": "boolean", "default": true }
      },
      "slash": [
        {
          "title": "To-do list",
          "description": "Tasks with checkboxes",
          "keywords": ["todo", "task", "checkbox", "checklist"],
          "section": "Lists",
          "icon": "checklist"
        }
      ]
    },
    {
      "name": "taskItem",
      "doc": "One task; ticking it anywhere edits this block. `attributes` keeps the item's trailing `{...}` span (D82) verbatim, so the editor round-trips it.",
      "impl": "tiptap",
      "content": "paragraph block*",
      "defining": true,
      "markdown": "list_item:task",
      "attrs": {
        "checked": { "type": "boolean", "default": false },
        "attributes": { "type": "string", "default": "" }
      }
    },
    {
      "name": "table",
      "doc": "A GFM table. Cells hold one paragraph, as GFM allows.",
      "impl": "custom",
      "group": "block",
      "content": "tableRow+",
      "isolating": true,
      "blockId": true,
      "markdown": "table",
      "slash": [
        {
          "title": "Table",
          "description": "Rows and columns",
          "keywords": ["grid", "gfm", "compare", "matrix"],
          "section": "Data",
          "icon": "table"
        }
      ]
    },
    {
      "name": "tableRow",
      "doc": "A table row.",
      "impl": "custom",
      "content": "(tableCell | tableHeader)*",
      "markdown": "table_row"
    },
    {
      "name": "tableHeader",
      "doc": "A header cell.",
      "impl": "custom",
      "content": "paragraph",
      "isolating": true,
      "markdown": "table_cell:header",
      "attrs": {
        "align": {
          "type": "enum",
          "values": ["none", "left", "center", "right"],
          "default": "none"
        }
      }
    },
    {
      "name": "tableCell",
      "doc": "A body cell.",
      "impl": "custom",
      "content": "paragraph",
      "isolating": true,
      "markdown": "table_cell",
      "attrs": {
        "align": {
          "type": "enum",
          "values": ["none", "left", "center", "right"],
          "default": "none"
        }
      }
    },
    {
      "name": "callout",
      "doc": "A coloured callout: `::: info`, `warn`, `good`, `crit`, `tip` or `note`.",
      "impl": "generic",
      "group": "block",
      "content": "block+",
      "defining": true,
      "blockId": true,
      "markdown": "container:callout",
      "attrs": {
        "kind": {
          "type": "enum",
          "values": ["info", "warn", "good", "crit", "tip", "note"],
          "default": "info"
        },
        "attributes": { "type": "string", "default": "" },
        "title": { "type": "string", "default": "" }
      },
      "slash": [
        {
          "title": "Info callout",
          "description": "Neutral information",
          "keywords": ["callout", "info", "aside"],
          "section": "Callouts",
          "icon": "info",
          "attrs": { "kind": "info" }
        },
        {
          "title": "Warning callout",
          "description": "Something to watch",
          "keywords": ["callout", "warn", "caution"],
          "section": "Callouts",
          "icon": "warning",
          "attrs": { "kind": "warn" }
        },
        {
          "title": "Success callout",
          "description": "Good news or a goal",
          "keywords": ["callout", "good", "success"],
          "section": "Callouts",
          "icon": "check_circle",
          "attrs": { "kind": "good" }
        },
        {
          "title": "Critical callout",
          "description": "Must not be missed",
          "keywords": ["callout", "crit", "danger", "error"],
          "section": "Callouts",
          "icon": "error",
          "attrs": { "kind": "crit" }
        },
        {
          "title": "Tip callout",
          "description": "A helpful hint",
          "keywords": ["callout", "tip", "hint"],
          "section": "Callouts",
          "icon": "lightbulb",
          "attrs": { "kind": "tip" }
        },
        {
          "title": "Note callout",
          "description": "A side note",
          "keywords": ["callout", "note"],
          "section": "Callouts",
          "icon": "sticky_note_2",
          "attrs": { "kind": "note" }
        }